news_id,headline,link,source,raw_date_text,news_datetime,article_text,scraped_at,scrape_page,status
4840fe13-33f8-48c1-8d14-afb562523511,"Brokerage Radar: CLSA maintains 'outperform' on Reliance Industries, SBI Cards bags upgrades from Nuvama, Nomura",https://www.moneycontrol.com/news/business/markets/brokerage-radar-clsa-maintains-outperform-on-reliance-industries-sbi-cards-bags-upgrades-from-nuvama-nomura-12903802.html,moneycontrol,"January 06, 2025 07:44 IST",2025-01-06T07:44:00+05:30,,2026-02-19T19:31:38.176856+05:30,,success
b84ab038-8889-43a1-93a6-35023a043c78,25 years of Jamnagar Refinery: Nita Ambani pays glowing tributes to senior employees of Reliance family,https://www.moneycontrol.com/news/india/25-years-of-jamnagar-refinery-nita-ambani-pays-glowing-tributes-to-senior-employees-of-reliance-family-12903447.html,moneycontrol,"January 04, 2025 21:14 IST",2025-01-04T21:14:00+05:30,,2026-02-19T19:31:40.565134+05:30,,success
93560ba0-ad06-40ca-9aad-9ffc5af42997,"Anant Ambani reflects on Jamnagar refinery’s legacy, vows to fulfill his father's vision",https://www.moneycontrol.com/news/business/anant-ambani-reflects-on-jamnagar-refinery-s-legacy-vows-to-fulfill-his-father-s-vision-12903309.html,moneycontrol,"January 04, 2025 13:35 IST",2025-01-04T13:35:00+05:30,,2026-02-19T19:31:42.927476+05:30,,success
7576489d-ee52-4445-99c4-a97b91686908,"In a historic first, India invites private participation in nuclear power",https://www.moneycontrol.com/news/business/in-a-historic-first-india-invites-private-participation-in-nuclear-power-12902242.html,moneycontrol,"January 02, 2025 17:37 IST",2025-01-02T17:37:00+05:30,,2026-02-19T19:31:45.380475+05:30,,success
812b31c7-54eb-4d40-a187-9797ae93867c,"Stocks to Watch Today: Hero MotoCorp, Ola Electric, Star Cement, Universal Autofoundry, Aerpace, Senores Pharma, Ventive Hospitality in focus on 30 December",https://www.moneycontrol.com/news/business/markets/stocks-to-watch-today-hero-motocorp-ola-electric-star-cement-universal-autofoundry-aerpace-senores-pharma-ventive-hospitality-in-focus-on-30-december-12899752.html,moneycontrol,"December 29, 2024 21:51 IST",2024-12-29T21:51:00+05:30,,2026-02-19T19:31:47.872054+05:30,,success
aa7cbcbb-1999-4d32-bff9-0d78d196be4d,Reliance acquires Karkinos Healthcare for Rs 375 crore,https://www.moneycontrol.com/news/business/companies/reliance-acquires-karkinos-healthcare-for-rs-375-crore-12899351.html,moneycontrol,"December 28, 2024 15:52 IST",2024-12-28T15:52:00+05:30,,2026-02-19T19:31:50.313196+05:30,,success
45d72f9d-3171-4dac-ab61-9146d10632b9,Exclusive | Will award 7.8 lakh tpa new green hydrogen production capacity in 2025: Pralhad Joshi,https://www.moneycontrol.com/news/business/companies/exclusive-will-award-7-8-lakh-tpa-new-green-hydrogen-production-capacity-in-2025-pralhad-joshi-12897027.html,moneycontrol,"December 24, 2024 17:09 IST",2024-12-24T17:09:00+05:30,,2026-02-19T19:31:52.717372+05:30,,success
55eac533-e25f-4af6-a4f3-a8f65199e053,"Rosneft, Reliance agree biggest ever India-Russia oil supply deal: Report",https://www.moneycontrol.com/news/business/rosneft-reliance-agree-biggest-ever-india-russia-oil-supply-deal-report-12888499.html,moneycontrol,"December 12, 2024 13:46 IST",2024-12-12T13:46:00+05:30,,2026-02-19T19:31:55.132764+05:30,,success
01c4d941-ce01-4682-8860-aa6cec20b3f7,Reliance Industries seeks up to $3 billion loan for refinancing,https://www.moneycontrol.com/news/business/companies/reliance-industries-seeks-up-to-3-billion-loan-for-refinancing-12886340.html,moneycontrol,"December 10, 2024 08:43 IST",2024-12-10T08:43:00+05:30,,2026-02-19T19:31:57.465848+05:30,,success
152b9f54-4201-46e3-ae0c-0f84787dac31,"Trade Spotlight: How should you trade Tata Motors, Affle India, Kaynes Technology, Ashoka Buildcon, ADF Foods, and others on Tuesday?",https://www.moneycontrol.com/news/business/markets/trade-spotlight-how-should-you-trade-tata-motors-affle-india-kaynes-technology-ashoka-buildcon-adf-foods-and-others-on-tuesday-12881497.html,moneycontrol,"December 02, 2024 23:51 IST",2024-12-02T23:51:00+05:30,,2026-02-19T19:31:59.892357+05:30,,success
14747624-5471-4f82-a829-be1cf23d771a,"Stock Radar: Enviro Infra, Zomato, KEI Industries, Paytm, Nykaa, LIC, PB Fintech, Newgen Software in focus on Friday",https://www.moneycontrol.com/news/business/markets/stock-radar-enviro-infra-zomato-kei-industries-paytm-nykaa-lic-pb-fintech-newgen-software-in-focus-on-friday-12879305.html,moneycontrol,"November 29, 2024 03:34 IST",2024-11-29T03:34:00+05:30,,2026-02-19T19:32:02.300566+05:30,,success
960d515b-470c-448f-bb00-917443e360ca,Reliance Industries arm acquires 21% stake in US-based Wavetech Helium for $12 million,https://www.moneycontrol.com/news/business/reliance-industries-arm-acquires-21-stake-in-us-based-wavetech-helium-for-12-million-12878968.html,moneycontrol,"November 28, 2024 17:06 IST",2024-11-28T17:06:00+05:30,,2026-02-19T19:32:04.734687+05:30,,success
795ece8d-af15-4f67-9e93-7f5c25795411,Reliance Industries stock surges 3% after Citi's upgrade to 'buy',https://www.moneycontrol.com/news/business/markets/citi-upgrades-reliance-industries-to-a-buy-as-risk-reward-turns-favourable-12874594.html,moneycontrol,"November 25, 2024 10:51 IST",2024-11-25T10:51:00+05:30,,2026-02-19T19:32:07.189937+05:30,,success
1368e581-1ccd-4af0-bd69-d77df3524da5,"Brokerages bullish on Reliance Industries as refining margins improve, see 36% upside",https://www.moneycontrol.com/news/business/markets/brokerages-bullish-on-reliance-industries-as-refining-margins-improve-see-36-upside-12873232.html,moneycontrol,"November 22, 2024 12:30 IST",2024-11-22T12:30:00+05:30,,2026-02-19T19:32:19.665051+05:30,,success
73842acb-8673-43a8-ba64-422513386789,"Chartist Talks: Markets rebound imminent despite downward trajectory, says Milan Vaishnav",https://www.moneycontrol.com/news/business/markets/chartist-talks-markets-rebound-imminent-despite-downward-trajectory-says-milan-vaishnav-12870857.html,moneycontrol,"November 20, 2024 06:15 IST",2024-11-20T06:15:00+05:30,,2026-02-19T19:32:22.115963+05:30,,success
e69e456b-33d3-41fb-8ac4-abfbff05e94b,"Stock Radar: Hero MotoCorp, Glenmark, Adani Total Gas, IGL, Cyient, ACME, Delhivery, Crompton Greaves, Honasa Consumer in focus on Monday",https://www.moneycontrol.com/news/business/markets/stock-radar-hero-motocorp-glenmark-adani-total-gas-igl-cyient-acme-delhivery-crompton-greaves-honasa-consumer-in-focus-on-monday-12869037.html,moneycontrol,"November 17, 2024 20:39 IST",2024-11-17T20:39:00+05:30,,2026-02-19T19:32:24.574218+05:30,,success
70a02aa7-6800-48ae-89c2-e38cba2a1388,Reliance and Disney complete transaction to form JV for entertainment brands in India,https://www.moneycontrol.com/news/business/reliance-and-disney-complete-transaction-to-form-jv-for-entertainment-brands-in-india-12867744.html,moneycontrol,"November 14, 2024 18:18 IST",2024-11-14T18:18:00+05:30,,2026-02-19T19:32:26.954014+05:30,,success
9f60f88f-9b18-42a9-b75d-fc2da5f320f2,Six of India’s top 10 most valuable firms shed Rs 1.55 lakh crore in market value,https://www.moneycontrol.com/news/business/markets/mcap-of-6-of-top-10-most-valued-firms-erode-rs-1-55-lakh-cr-reliance-biggest-laggard-12862200.html,moneycontrol,"November 10, 2024 21:36 IST",2024-11-10T21:36:00+05:30,,2026-02-19T19:32:29.340051+05:30,,success
c8128765-226e-4fa8-b734-e6e910ff0cd8,"Hurun Philanthropy List: HCLTech's Shiv Nadar is India's most generous, Reliance Industries has the highest CSR spend",https://www.moneycontrol.com/technology/hurun-philanthropy-list-hcltechs-shiv-nadar-is-indias-most-generous-reliance-industries-has-the-highest-csr-spend-article-12860401.html,moneycontrol,"November 07, 2024 14:13 IST",2024-11-07T14:13:00+05:30,,2026-02-19T19:32:31.762548+05:30,,success
0d7f5c42-ea71-4831-9f6c-d14933119efe,"Reliance Jio IPO set for 2025, retail debut much later",https://www.moneycontrol.com/news/business/ipo/reliance-jio-ipo-set-for-2025-retail-debut-much-later-report-12857660.html,moneycontrol,"November 04, 2024 16:11 IST",2024-11-04T16:11:00+05:30,,2026-02-19T19:32:34.155807+05:30,,success
1292cdef-6cfc-4b71-af95-26c63437d118,"Larsen & Toubro: Faster recovery in H2 likely, higher order inflows take focus",https://www.moneycontrol.com/news/business/stocks/larsen-toubro-better-recovery-in-h2-likely-aided-by-higher-order-inflows-12855896.html,moneycontrol,"November 04, 2024 15:47 IST",2024-11-04T15:47:00+05:30,,2026-02-19T19:32:36.491934+05:30,,success
6f450e50-0968-4a8e-874e-55f77da84a3a,"Stock Radar: Voltas, Marico, Torrent Pharma, Godavari Biorefineries, Sar Televenture, Kaynes Tech, Hitachi Energy in focus on Wednesday",https://www.moneycontrol.com/news/business/markets/stock-radar-voltas-marico-torrent-pharma-godavari-biorefineries-sar-televenture-kaynes-tech-hitachi-energy-in-focus-on-wednesday-12854420.html,moneycontrol,"October 30, 2024 01:57 IST",2024-10-30T01:57:00+05:30,,2026-02-19T19:32:38.975468+05:30,,success
973187c4-f728-4aa9-baa6-0937fa14f9d5,"Reliance New Energy, an RIL subsidiary, completes acquisition of remaining stake in Faradion",https://www.moneycontrol.com/news/business/markets/reliance-new-energy-completes-acquisition-of-faradion-12854252.html,moneycontrol,"October 29, 2024 18:37 IST",2024-10-29T18:37:00+05:30,,2026-02-19T19:32:41.373166+05:30,,success
e81cfa73-8e18-4ffd-ad31-cb9e6430c750,"Stock Radar: ICICI Bank, Waaree Energies, IndiGo, Inox Wind, DLF, Lodha, Bandhan Bank, Coal India, ITD Cementation in focus on Monday",https://www.moneycontrol.com/news/business/markets/stock-radar-icici-bank-waaree-energies-indigo-inox-wind-dlf-lodha-bandhan-bank-coal-india-itd-cementation-in-focus-on-monday-12851272.html,moneycontrol,"October 28, 2024 02:52 IST",2024-10-28T02:52:00+05:30,,2026-02-19T19:32:43.918438+05:30,,success
c19079c4-0c04-4993-ae5e-2f88c8d44347,"Nvidia, RIL to build AI infra to unlock India’s potential from massive user base, growing data",https://www.moneycontrol.com/technology/nvidia-ril-to-build-ai-infra-to-unlock-indias-potential-from-massive-user-base-growing-data-article-12849943.html,moneycontrol,"October 24, 2024 16:53 IST",2024-10-24T16:53:00+05:30,,2026-02-19T19:32:46.346123+05:30,,success
0605ba2c-3881-4ddb-a98d-c09dea75ab52,Reliance and Nvidia are partnering to build AI infra in India: Jensen Huang,https://www.moneycontrol.com/technology/reliance-and-nvidia-are-partnering-to-build-ai-infra-in-india-jensen-huang-article-12849811.html,moneycontrol,"October 24, 2024 14:19 IST",2024-10-24T14:19:00+05:30,,2026-02-19T19:32:48.793570+05:30,,success
37d61852-dc58-4d53-92da-bd2259a99156,"Reliance Consolidated September 2024 Net Sales at Rs 231,535.00 crore, down 0.15% Y-o-Y",https://www.moneycontrol.com/news/business/earnings/reliance-consolidated-september-2024-net-sales-at-rs-231535-00-crore-down-0-15-y-o-y-12847753.html,moneycontrol,"October 22, 2024 14:00 IST",2024-10-22T14:00:00+05:30,,2026-02-19T19:32:51.276375+05:30,,success
a8c7ceee-6863-484b-86ec-66bb7c7a4a97,"Reliance Standalone September 2024 Net Sales at Rs 130,108.00 crore, down 5.29% Y-o-Y",https://www.moneycontrol.com/news/business/earnings/reliance-standalone-september-2024-net-sales-at-rs-130108-00-crore-down-5-29-y-o-y-12846717.html,moneycontrol,"October 21, 2024 14:50 IST",2024-10-21T14:50:00+05:30,,2026-02-19T19:32:54.287178+05:30,,success
0df075a7-5ba6-488d-85b3-7208e50eea21,"Stock Radar: Infosys, Wipro, Axis Bank, LTIMindtree, Zomato, MGL, IGL, Polycab, Tata Chemicals in focus on Friday",https://www.moneycontrol.com/news/business/markets/stock-radar-infosys-wipro-axis-bank-ltimindtree-zomato-mgl-igl-polycab-tata-chemicals-in-focus-on-friday-12844462.html,moneycontrol,"October 18, 2024 01:10 IST",2024-10-18T01:10:00+05:30,,2026-02-19T19:32:56.751564+05:30,,success
bc5cd8be-33d9-4335-a5b3-61268896cdfe,"Reliance Brands, Mothercare deepen ties with new joint venture for South Asia",https://www.moneycontrol.com/news/business/reliance-brands-mothercare-deepen-ties-with-new-joint-venture-for-south-asia-12844460.html,moneycontrol,"October 18, 2024 00:25 IST",2024-10-18T00:25:00+05:30,,2026-02-19T19:32:59.242555+05:30,,success
e352429c-b76a-46b1-af23-0f0bf3b3fd81,"Stock Radar: Bajaj Auto, L&T Technology, Rail Vikas Nigam, Bikaji Foods, Oriana Power, Pondy Oxide in focus on Thursday",https://www.moneycontrol.com/news/business/markets/stock-radar-bajaj-auto-lt-technology-rail-vikas-nigam-bikaji-foods-oriana-power-pondy-oxide-in-focus-on-thursday-12843664.html,moneycontrol,"October 17, 2024 00:32 IST",2024-10-17T00:32:00+05:30,,2026-02-19T19:33:01.715085+05:30,,success
62d48bb6-5efd-4eb4-9954-9f2524d858a4,"Reliance Industries Q2: Consumption-oriented segments telecom, retail drive growth",https://www.moneycontrol.com/news/business/stocks/reliance-industries-q2-consumption-oriented-segments-telecom-retail-drive-growth-12841938.html,moneycontrol,"October 14, 2024 23:16 IST",2024-10-14T23:16:00+05:30,,2026-02-19T19:33:04.136643+05:30,,success
9c8609f9-dc17-43f6-a04c-9b759489db9e,"RIL O2C Q2 results: Revenue up 5%, EBITDA falls 24% amid decline in product margin",https://www.moneycontrol.com/news/business/earnings/ril-o2c-q2-results-revenue-up-5-ebitda-falls-24-amid-decline-in-product-margin-12841914.html,moneycontrol,"October 14, 2024 22:15 IST",2024-10-14T22:15:00+05:30,,2026-02-19T19:33:06.550885+05:30,,success
351d8ce6-af3a-4a06-8856-9817f852466c,Reliance Industries records robust growth in digital services and upstream business in Q2: Here are 10 key highlights,https://www.moneycontrol.com/news/business/earnings/reliance-industries-records-robust-growth-in-digital-services-and-upstream-business-in-q2-here-are-10-key-highlights-12841910.html,moneycontrol,"October 14, 2024 21:50 IST",2024-10-14T21:50:00+05:30,,2026-02-19T19:33:09.518313+05:30,,success
5d920e4d-e045-4c55-b924-2c8d9b6bfe84,New JioFinance app launched with a wide array of financial products and services,https://www.moneycontrol.com/news/business/new-jiofinance-app-launched-with-a-wide-array-of-financial-products-and-services-12840064.html,moneycontrol,"October 11, 2024 12:38 IST",2024-10-11T12:38:00+05:30,,2026-02-19T19:33:12.961355+05:30,,success
b416e0b1-1d6e-438c-9790-1283ebd7cd0e,"Trade Spotlight: How should you trade HDFC Bank, Infosys, eMudhra, RR Kabel, Vedanta and others on Tuesday?",https://www.moneycontrol.com/news/business/markets/trade-spotlight-how-should-you-trade-hdfc-bank-infosys-emudhra-rr-kabel-vedanta-and-others-on-tuesday-12837559.html,moneycontrol,"October 08, 2024 01:19 IST",2024-10-08T01:19:00+05:30,,2026-02-19T19:33:15.402334+05:30,,success
41b23c72-0c5c-4698-ba81-118bd048773a,Reliance secures Govt's approval for transfer of Viacom18's non-news and current affairs TV channels licenses to Star India,https://www.moneycontrol.com/news/business/reliance-secures-govts-approval-for-transfer-of-viacom18s-non-news-and-current-affairs-tv-channels-licenses-to-star-india-12831523.html,moneycontrol,"September 28, 2024 19:12 IST",2024-09-28T19:12:00+05:30,,2026-02-19T19:33:17.843074+05:30,,success
fc6e3296-e65e-4752-bba0-6903905990b8,"Stock Radar: ONGC, Reliance, PNB, AstraZeneca, GR Infra, BGR Energy, Arkade Developers, Coal India in focus on Tuesday",https://www.moneycontrol.com/news/business/markets/stock-radar-ongc-reliance-pnb-astrazeneca-gr-infra-bgr-energy-arkade-developers-coal-india-in-focus-on-tuesday-12828188.html,moneycontrol,"September 24, 2024 01:17 IST",2024-09-24T01:17:00+05:30,,2026-02-19T19:33:20.351969+05:30,,success
b123d354-9d8f-47de-968f-25783ba720e7,"Stock Radar: Dr Reddys, Mankind, Adani Total Gas, Aarti Drugs, BHEL, HFCL, Vodafone in focus on Monday",https://www.moneycontrol.com/news/business/markets/stock-radar-dr-reddys-mankind-adani-total-gas-aarti-drugs-bhel-hfcl-vodafone-in-focus-on-monday-12827369.html,moneycontrol,"September 23, 2024 03:26 IST",2024-09-23T03:26:00+05:30,,2026-02-19T19:33:22.762833+05:30,,success
d03d33cb-24df-4f63-a47d-c00f05668a5e,Ambani family celebrates Ganesh Chaturthi with devotion and grandeur at Antilia,https://www.moneycontrol.com/news/india/ambani-family-celebrates-ganesh-chaturthi-with-devotion-and-grandeur-at-antilia-12816786.html,moneycontrol,"September 07, 2024 21:35 IST",2024-09-07T21:35:00+05:30,,2026-02-19T19:33:25.145564+05:30,,success
88df8107-219c-4a74-8a87-bbe966e04d3c,Reliance Industries secures 10 GWh ACC battery storage capacity under PLI scheme,https://www.moneycontrol.com/news/business/reliance-industries-secures-10-gwh-acc-battery-manufacturing-under-pli-scheme-to-reduce-import-dependence-12814413.html,moneycontrol,"September 04, 2024 19:12 IST",2024-09-04T19:12:00+05:30,,2026-02-19T19:33:27.543915+05:30,,success
1ca2b8d0-41aa-4f84-ab33-ab9075892b38,How brokerages value Reliance Industries' business segments,https://www.moneycontrol.com/news/business/markets/rils-sotp-valuation-how-brokerages-value-reliance-industries-business-segments-12812131.html,moneycontrol,"September 03, 2024 11:04 IST",2024-09-03T11:04:00+05:30,,2026-02-19T19:33:30.061807+05:30,,success
00009693-7b26-41d3-af59-3fce46c76849,Hopeful of getting regulatory approvals for business with BlackRock: Jio Financial management,https://www.moneycontrol.com/news/business/hopeful-of-getting-regulatory-approvals-for-business-with-blackrock-jio-financial-management-12810805.html,moneycontrol,"August 30, 2024 15:18 IST",2024-08-30T15:18:00+05:30,,2026-02-19T19:33:32.604622+05:30,,success
150b2f9d-2c14-4c99-9386-cef9acf9b75a,"Brokerages remain bullish as Reliance Industries aims to double EBITDA, expand O2C, retail, and new energy",https://www.moneycontrol.com/news/business/markets/brokerages-remain-bullish-as-reliance-industries-aims-to-double-ebitda-expand-o2c-retail-and-new-energy-12810246.html,moneycontrol,"August 30, 2024 09:53 IST",2024-08-30T09:53:00+05:30,,2026-02-19T19:33:35.155368+05:30,,success
6c9cbaf8-68c6-4dc6-a29f-268591b03a09,"Brokerage Radar: Price upgrades for OMCs, Bharti Airtel; bullish views for RIL",https://www.moneycontrol.com/news/business/markets/brokerage-radar-price-upgrades-for-omcs-bharti-airtel-bullish-views-for-ril-12810240.html,moneycontrol,"August 30, 2024 07:52 IST",2024-08-30T07:52:00+05:30,,2026-02-19T19:33:37.609655+05:30,,success
4897730e-9399-42b9-b6f7-17e572a57975,"Mukesh Ambani steers Reliance towards deep-tech, sustainable future",https://www.moneycontrol.com/news/business/mukesh-ambani-steers-reliance-towards-deep-tech-sustainable-future-12810110.html,moneycontrol,"August 29, 2024 19:51 IST",2024-08-29T19:51:00+05:30,,2026-02-19T19:33:40.085062+05:30,,success
bf86cf21-745f-4c0c-876d-8ed76430f047,"Personal or family wealth means nothing to me, says RIL chairman Mukesh Ambani",https://www.moneycontrol.com/news/business/companies/personal-or-family-wealth-means-nothing-to-me-says-ril-chairman-mukesh-ambani-12810021.html,moneycontrol,"August 29, 2024 19:10 IST",2024-08-29T19:10:00+05:30,,2026-02-19T19:33:42.540889+05:30,,success
a278ccef-77b0-4bff-a75a-c6bf8b8c1c9d,Reliance Industries well on track to more than double in size before end of this decade: Mukesh Ambani,https://www.moneycontrol.com/news/business/reliance-industries-well-on-track-to-more-than-double-in-size-before-end-of-this-decade-mukesh-ambani-12809963.html,moneycontrol,"August 29, 2024 16:59 IST",2024-08-29T16:59:00+05:30,,2026-02-19T19:33:45.295570+05:30,,success
ba36f00d-dc03-480f-808d-4e487f71b597,"Akash, Isha, Anant stepped up to take greater responsibilities, RIL expanding pool of capable leaders: Mukesh Ambani",https://www.moneycontrol.com/news/business/companies/akash-isha-anant-stepped-up-to-take-greater-responsibilities-ril-expanding-pool-of-capable-leaders-says-mukesh-ambani-12809990.html,moneycontrol,"August 29, 2024 19:00 IST",2024-08-29T19:00:00+05:30,,2026-02-19T19:33:47.792037+05:30,,success
7b7e38af-e68e-4191-b67a-9f165435b9f6,"Moneycontrol transforming into advanced fintech player, says RIL's Mukesh Ambani",https://www.moneycontrol.com/news/business/companies/moneycontrol-transforming-into-advanced-fintech-player-says-rils-mukesh-ambani-12809954.html,moneycontrol,"August 29, 2024 16:31 IST",2024-08-29T16:31:00+05:30,,2026-02-19T19:33:50.245229+05:30,,success
da157624-1ee3-4cb7-bd2d-2516f5a29e33,"RIL AGM 2024: Electrolyser giga factory to be ready by 2026, says Mukesh Ambani",https://www.moneycontrol.com/news/business/reliance-agm-2024-electrolyser-giga-factory-to-be-ready-by-2026-says-mukesh-ambani-12809632.html,moneycontrol,"August 29, 2024 17:51 IST",2024-08-29T17:51:00+05:30,,2026-02-19T19:33:52.680325+05:30,,success
07fa3458-d983-4c5e-96a5-1f3991b5a711,RIL to start solar photovoltaic modules production by 2024-end: Chairman Ambani,https://www.moneycontrol.com/news/business/companies/ril-to-start-solar-photovoltaic-modules-production-by-2024-end-chairman-ambani-12809873.html,moneycontrol,"August 29, 2024 15:59 IST",2024-08-29T15:59:00+05:30,,2026-02-19T19:33:55.197429+05:30,,success
a934f14d-2a37-4f21-b5ce-1401b707cb42,"RIL’s AI Jio Brain: Mukesh Ambani tells shareholders how AI can help agriculture, education, healthcare, more",https://www.moneycontrol.com/news/business/markets/rils-ai-jio-brain-mukesh-ambani-tells-shareholders-how-ai-can-help-agriculture-education-healthcare-more-12809821.html,moneycontrol,"August 29, 2024 15:09 IST",2024-08-29T15:09:00+05:30,,2026-02-19T19:33:57.682170+05:30,,success
c2aa6353-f30a-4935-9170-00008ef10abd,"Jio users to get 100 GB of free cloud storage starting Diwali, says RIL chairman Ambani",https://www.moneycontrol.com/news/business/companies/jio-users-to-get-100-gb-of-free-cloud-storage-starting-diwali-says-ril-chairman-ambani-12809771.html,moneycontrol,"August 29, 2024 15:24 IST",2024-08-29T15:24:00+05:30,,2026-02-19T19:34:00.665760+05:30,,success
7f0affd4-62d5-40aa-982a-bc295d626af0,"Reliance Industries bonus issue creates positive sentiment for RIL shares, analysts see 15% upside",https://www.moneycontrol.com/news/business/markets/reliance-industries-bonus-issue-creates-positive-sentiment-for-ril-shares-analysts-see-15-upside-12809791.html,moneycontrol,"August 29, 2024 15:21 IST",2024-08-29T15:21:00+05:30,,2026-02-19T19:34:03.142096+05:30,,success
f3ce7866-f079-47e1-9610-4a53fce21c38,"Mukesh Ambani at RIL AGM: AI ramp up, new energy updates and 1:1 bonus",https://www.moneycontrol.com/news/business/markets/mukesh-ambani-reliance-agm-top-highlights-updates-12809730.html,moneycontrol,"August 29, 2024 16:45 IST",2024-08-29T16:45:00+05:30,,2026-02-19T19:34:05.505198+05:30,,success
59d98a91-18c1-4202-911a-99b99d39c10a,Reliance Industries share price jumps 2.6% as board to consider bonus issue next week,https://www.moneycontrol.com/news/business/markets/reliance-industries-share-price-jumps-2-6-as-board-to-consider-bonus-issue-next-week-12809766.html,moneycontrol,"August 29, 2024 14:24 IST",2024-08-29T14:24:00+05:30,,2026-02-19T19:34:07.915241+05:30,,success
c4efb2b2-7f31-4b6f-b3fa-7bd5daedb7f9,"Reliance Industries to consider 1:1 bonus shares at September 5 board meeting, stock rises 2%",https://www.moneycontrol.com/news/business/companies/reliance-industries-to-consider-11-bonus-shares-at-september-5-board-meeting-12809737.html,moneycontrol,"August 29, 2024 14:20 IST",2024-08-29T14:20:00+05:30,,2026-02-19T19:34:10.349270+05:30,,success
a51be236-a43e-45ab-936a-a84c448bf235,"Stock Radar: Reliance Industries, Vedanta, Paytm, KEC International, IndiGo, PB Fintech in focus on Thursday",https://www.moneycontrol.com/news/business/markets/stock-radar-reliance-industries-vedanta-paytm-kec-international-indigo-pb-fintech-in-focus-on-thursday-12809378.html,moneycontrol,"August 29, 2024 01:50 IST",2024-08-29T01:50:00+05:30,,2026-02-19T19:34:13.665886+05:30,,success
591cff9b-ca72-4dce-ba96-5574d96e3a69,"Jio, retail IPOs to new energy updates: 5 key things to watch out for at RIL AGM",https://www.moneycontrol.com/news/business/markets/jio-retail-ipos-to-new-energy-updates-5-key-things-to-watch-at-the-ril-agm-12808506.html,moneycontrol,"August 28, 2024 11:36 IST",2024-08-28T11:36:00+05:30,,2026-02-19T19:34:16.125843+05:30,,success
019071eb-ab40-43f5-aae9-b5e66f647abe,"Brokerage Radar: Apollo Hospitals gets a downgrade; Bansal Wire, Emcure Pharma get 'buy' tags",https://www.moneycontrol.com/news/business/markets/brokerage-radar-apollo-hospitals-gets-a-downgrade-bansal-wire-emcure-pharma-get-buy-tags-12806395.html,moneycontrol,"August 26, 2024 07:23 IST",2024-08-26T07:23:00+05:30,,2026-02-19T19:34:18.565161+05:30,,success
7e9da008-b772-4fbd-88a9-98424ea1f49b,"Brokerages remain bullish on Reliance Industries, highlight Jio’s growth potential",https://www.moneycontrol.com/news/business/markets/brokerages-retain-bullishness-on-reliance-industries-highlight-jios-growth-potential-12804590.html,moneycontrol,"August 23, 2024 10:52 IST",2024-08-23T10:52:00+05:30,,2026-02-19T19:34:21.029537+05:30,,success
869b9943-09e9-42a4-960e-6e0f285acccf,"Stock Radar: Cyient, PNB Housing Finance, Genus Power Infra, Petronet LNG, Ola Electric in focus on Wednesday",https://www.moneycontrol.com/news/business/markets/stock-radar-cyient-pnb-housing-finance-genus-power-infra-petronet-lng-ola-electric-in-focus-on-wednesday-12802231.html,moneycontrol,"August 21, 2024 01:52 IST",2024-08-21T01:52:00+05:30,,2026-02-19T19:34:23.452175+05:30,,success
563fa435-cbe2-43ea-ba33-4638dda4839a,RRVL at $100-billion valuation milestone; well positioned to serve consumption needs of fast-growing economy: Mukesh Ambani,https://www.moneycontrol.com/news/business/rrvl-at-100-billion-valuation-milestone-well-positioned-to-serve-consumption-needs-of-fast-growing-economy-mukesh-ambani-12790181.html,moneycontrol,"August 07, 2024 19:23 IST",2024-08-07T19:23:00+05:30,,2026-02-19T19:34:25.846286+05:30,,success
